{
  "$schema": "https://json-schema.org/draft/2020-12/schema",
  "$id": "bikelog/product-templates/spokes.schema.json",
  "title": "Bike Log product: Spokes (set)",
  "description": "One product (what you can buy) and optionally physical items you own. Only component_type, maker and model are required. Unlisted spec keys are imported too.",
  "type": "object",
  "required": [
    "component_type",
    "maker",
    "model"
  ],
  "additionalProperties": false,
  "properties": {
    "format": {
      "const": "bikelog.product.v1"
    },
    "component_type": {
      "const": "SPOKES"
    },
    "maker": {
      "type": "string",
      "minLength": 1
    },
    "model": {
      "type": "string",
      "minLength": 1,
      "description": "Model name or number, unique per maker"
    },
    "list_price": {
      "type": "number",
      "minimum": 0,
      "description": "Reference price in euro (not money spent)"
    },
    "currency": {
      "const": "EUR"
    },
    "specs": {
      "type": "object",
      "properties": {
        "count": {
          "type": "number",
          "description": "Number of spokes"
        },
        "model": {
          "type": "string",
          "description": "Spoke model"
        },
        "length_mm": {
          "type": "number",
          "description": "Length (front, or both sides) (mm)"
        },
        "length_drive_mm": {
          "type": "number",
          "description": "Length, rear drive side (mm)"
        },
        "length_non_drive_mm": {
          "type": "number",
          "description": "Length, rear non-drive side (mm)"
        },
        "nipples": {
          "type": "string",
          "description": "Nipples"
        },
        "weight_g": {
          "type": "number",
          "description": "Weight (g)"
        },
        "color": {
          "type": "string",
          "description": "Colour / finish"
        },
        "material": {
          "type": "string",
          "description": "Main material"
        }
      },
      "additionalProperties": true
    },
    "source": {
      "type": "object",
      "additionalProperties": false,
      "properties": {
        "url": {
          "type": "string"
        },
        "retrieved_at": {
          "type": "string",
          "format": "date"
        },
        "tool": {
          "type": "string",
          "description": "Script name and version"
        }
      }
    },
    "verified": {
      "type": "boolean",
      "description": "true only if checked against the maker's documentation"
    },
    "notes": {
      "type": "string"
    },
    "items": {
      "type": "array",
      "description": "Physical parts you own of this product (added as spares)",
      "items": {
        "type": "object",
        "required": [
          "label"
        ],
        "additionalProperties": false,
        "properties": {
          "label": {
            "type": "string",
            "minLength": 1
          },
          "price": {
            "type": "number",
            "minimum": 0,
            "description": "Price paid in euro"
          },
          "purchase_date": {
            "type": "string",
            "format": "date"
          },
          "prior_usage": {
            "enum": [
              "NEW",
              "UNKNOWN"
            ]
          },
          "serial_number": {
            "type": "string"
          },
          "storage_location": {
            "type": "string"
          },
          "notes": {
            "type": "string"
          }
        }
      }
    }
  }
}
