{
  "format": "bikelog.product.v1",
  "component_type": "SPOKES",
  "maker": "Example maker",
  "model": "Example spokes (set) 1",
  "list_price": 49.9,
  "currency": "EUR",
  "specs": {
    "count": 24,
    "model": "DT Aerolite 286 mm",
    "nipples": "alloy, 14 mm",
    "weight_g": 250
  },
  "source": {
    "url": "https://example.com/product-page",
    "retrieved_at": "2026-10-25",
    "tool": "my-scraper 1.0"
  },
  "verified": false,
  "notes": "Optional free text",
  "items": [
    {
      "label": "Spare spokes (set) 1",
      "price": 44.9,
      "purchase_date": "2026-10-20",
      "prior_usage": "NEW",
      "storage_location": "Workshop drawer"
    }
  ]
}
